{
  "schemaVersion": "1.0.0",
  "scheduleId": "schedule_7_v1_3_2",
  "sourceKind": "canonical_reconstruction",
  "demandDataVersion": "bts-db1c-6mo-jul2025-apr2026-v7",
  "summary": {
    "legCount": 1229,
    "marketRows": 681,
    "stationCount": 105,
    "fleetTypes": 4
  },
  "fleetPlan": {
    "MAX9": {
      "aircraftCount": 35,
      "aircraftDaysUsed": 24,
      "legCount": 170,
      "blockMinutes": 18608,
      "minimumTurnMinutes": 5840,
      "requiredAircraftMinutes": 24448
    },
    "CRJ900": {
      "aircraftCount": 45,
      "aircraftDaysUsed": 28,
      "legCount": 164,
      "blockMinutes": 19700,
      "minimumTurnMinutes": 5440,
      "requiredAircraftMinutes": 25140
    },
    "CRJ700": {
      "aircraftCount": 65,
      "aircraftDaysUsed": 56,
      "legCount": 349,
      "blockMinutes": 35905,
      "minimumTurnMinutes": 11720,
      "requiredAircraftMinutes": 47625
    },
    "CRJ200": {
      "aircraftCount": 80,
      "aircraftDaysUsed": 76,
      "legCount": 546,
      "blockMinutes": 40832,
      "minimumTurnMinutes": 18800,
      "requiredAircraftMinutes": 59632
    }
  },
  "markets": [
    {
      "fleet": "CRJ200",
      "origin": "ABE",
      "destination": "PHF",
      "legs": 2
    },
    {
      "fleet": "CRJ200",
      "origin": "ABE",
      "destination": "SYR",
      "legs": 1
    },
    {
      "fleet": "CRJ200",
      "origin": "ACY",
      "destination": "PHF",
      "legs": 2
    },
    {
      "fleet": "CRJ200",
      "origin": "ACY",
      "destination": "SYR",
      "legs": 1
    },
    {
      "fleet": "CRJ200",
      "origin": "AGS",
      "destination": "JAX",
      "legs": 2
    },
    {
      "fleet": "CRJ200",
      "origin": "ALB",
      "destination": "PHF",
      "legs": 1
    },
    {
      "fleet": "CRJ200",
      "origin": "ALB",
      "destination": "RDU",
      "legs": 1
    },
    {
      "fleet": "CRJ200",
      "origin": "ALB",
      "destination": "SYR",
      "legs": 4
    },
    {
      "fleet": "CRJ200",
      "origin": "ATW",
      "destination": "BHM",
      "legs": 1
    },
    {
      "fleet": "CRJ200",
      "origin": "ATW",
      "destination": "DAY",
      "legs": 3
    },
    {
      "fleet": "CRJ200",
      "origin": "ATW",
      "destination": "MCI",
      "legs": 2
    },
    {
      "fleet": "CRJ200",
      "origin": "AVL",
      "destination": "DAY",
      "legs": 1
    },
    {
      "fleet": "CRJ200",
      "origin": "AVL",
      "destination": "JAX",
      "legs": 2
    },
    {
      "fleet": "CRJ200",
      "origin": "AVP",
      "destination": "PHF",
      "legs": 2
    },
    {
      "fleet": "CRJ200",
      "origin": "BDL",
      "destination": "SYR",
      "legs": 2
    },
    {
      "fleet": "CRJ200",
      "origin": "BGR",
      "destination": "SYR",
      "legs": 2
    },
    {
      "fleet": "CRJ200",
      "origin": "BHM",
      "destination": "ATW",
      "legs": 1
    },
    {
      "fleet": "CRJ200",
      "origin": "BHM",
      "destination": "DAB",
      "legs": 2
    },
    {
      "fleet": "CRJ200",
      "origin": "BHM",
      "destination": "DAY",
      "legs": 3
    },
    {
      "fleet": "CRJ200",
      "origin": "BHM",
      "destination": "ECP",
      "legs": 1
    },
    {
      "fleet": "CRJ200",
      "origin": "BHM",
      "destination": "EYW",
      "legs": 1
    },
    {
      "fleet": "CRJ200",
      "origin": "BHM",
      "destination": "FSD",
      "legs": 1
    },
    {
      "fleet": "CRJ200",
      "origin": "BHM",
      "destination": "HRL",
      "legs": 1
    },
    {
      "fleet": "CRJ200",
      "origin": "BHM",
      "destination": "ICT",
      "legs": 1
    },
    {
      "fleet": "CRJ200",
      "origin": "BHM",
      "destination": "LBB",
      "legs": 1
    },
    {
      "fleet": "CRJ200",
      "origin": "BHM",
      "destination": "MCI",
      "legs": 2
    },
    {
      "fleet": "CRJ200",
      "origin": "BHM",
      "destination": "OMA",
      "legs": 2
    },
    {
      "fleet": "CRJ200",
      "origin": "BHM",
      "destination": "PIE",
      "legs": 2
    },
    {
      "fleet": "CRJ200",
      "origin": "BHM",
      "destination": "SFB",
      "legs": 1
    },
    {
      "fleet": "CRJ200",
      "origin": "BHM",
      "destination": "SGF",
      "legs": 2
    },
    {
      "fleet": "CRJ200",
      "origin": "BHM",
      "destination": "SRQ",
      "legs": 1
    },
    {
      "fleet": "CRJ200",
      "origin": "BHM",
      "destination": "TUL",
      "legs": 2
    },
    {
      "fleet": "CRJ200",
      "origin": "BHM",
      "destination": "VPS",
      "legs": 1
    },
    {
      "fleet": "CRJ200",
      "origin": "BHM",
      "destination": "XNA",
      "legs": 2
    },
    {
      "fleet": "CRJ200",
      "origin": "BLV",
      "destination": "MCI",
      "legs": 1
    },
    {
      "fleet": "CRJ200",
      "origin": "BNA",
      "destination": "DAY",
      "legs": 1
    },
    {
      "fleet": "CRJ200",
      "origin": "BNA",
      "destination": "MCI",
      "legs": 1
    },
    {
      "fleet": "CRJ200",
      "origin": "BNA",
      "destination": "SYR",
      "legs": 1
    },
    {
      "fleet": "CRJ200",
      "origin": "BTR",
      "destination": "JAX",
      "legs": 2
    },
    {
      "fleet": "CRJ200",
      "origin": "BTV",
      "destination": "SYR",
      "legs": 3
    },
    {
      "fleet": "CRJ200",
      "origin": "BUF",
      "destination": "DAY",
      "legs": 2
    },
    {
      "fleet": "CRJ200",
      "origin": "BUF",
      "destination": "SYR",
      "legs": 4
    },
    {
      "fleet": "CRJ200",
      "origin": "BWI",
      "destination": "PVD",
      "legs": 1
    },
    {
      "fleet": "CRJ200",
      "origin": "BWI",
      "destination": "PWM",
      "legs": 1
    },
    {
      "fleet": "CRJ200",
      "origin": "BWI",
      "destination": "SYR",
      "legs": 1
    },
    {
      "fleet": "CRJ200",
      "origin": "CAE",
      "destination": "JAX",
      "legs": 1
    },
    {
      "fleet": "CRJ200",
      "origin": "CAE",
      "destination": "PHF",
      "legs": 2
    },
    {
      "fleet": "CRJ200",
      "origin": "CAK",
      "destination": "DAY",
      "legs": 2
    },
    {
      "fleet": "CRJ200",
      "origin": "CAK",
      "destination": "MCI",
      "legs": 1
    },
    {
      "fleet": "CRJ200",
      "origin": "CAK",
      "destination": "SYR",
      "legs": 3
    },
    {
      "fleet": "CRJ200",
      "origin": "CHA",
      "destination": "DAY",
      "legs": 1
    },
    {
      "fleet": "CRJ200",
      "origin": "CHA",
      "destination": "JAX",
      "legs": 2
    },
    {
      "fleet": "CRJ200",
      "origin": "CHS",
      "destination": "DAY",
      "legs": 1
    },
    {
      "fleet": "CRJ200",
      "origin": "CHS",
      "destination": "JAX",
      "legs": 1
    },
    {
      "fleet": "CRJ200",
      "origin": "CID",
      "destination": "MCI",
      "legs": 3
    },
    {
      "fleet": "CRJ200",
      "origin": "CLT",
      "destination": "MCI",
      "legs": 1
    },
    {
      "fleet": "CRJ200",
      "origin": "CMH",
      "destination": "DAY",
      "legs": 1
    },
    {
      "fleet": "CRJ200",
      "origin": "COU",
      "destination": "MCI",
      "legs": 2
    },
    {
      "fleet": "CRJ200",
      "origin": "CRP",
      "destination": "MCI",
      "legs": 2
    },
    {
      "fleet": "CRJ200",
      "origin": "CRW",
      "destination": "DAY",
      "legs": 2
    },
    {
      "fleet": "CRJ200",
      "origin": "DAB",
      "destination": "BHM",
      "legs": 2
    },
    {
      "fleet": "CRJ200",
      "origin": "DAB",
      "destination": "JAX",
      "legs": 1
    },
    {
      "fleet": "CRJ200",
      "origin": "DAY",
      "destination": "ATW",
      "legs": 3
    },
    {
      "fleet": "CRJ200",
      "origin": "DAY",
      "destination": "AVL",
      "legs": 1
    },
    {
      "fleet": "CRJ200",
      "origin": "DAY",
      "destination": "BHM",
      "legs": 3
    },
    {
      "fleet": "CRJ200",
      "origin": "DAY",
      "destination": "BNA",
      "legs": 1
    },
    {
      "fleet": "CRJ200",
      "origin": "DAY",
      "destination": "BUF",
      "legs": 2
    },
    {
      "fleet": "CRJ200",
      "origin": "DAY",
      "destination": "CAK",
      "legs": 2
    },
    {
      "fleet": "CRJ200",
      "origin": "DAY",
      "destination": "CHA",
      "legs": 1
    },
    {
      "fleet": "CRJ200",
      "origin": "DAY",
      "destination": "CHS",
      "legs": 1
    },
    {
      "fleet": "CRJ200",
      "origin": "DAY",
      "destination": "CMH",
      "legs": 1
    },
    {
      "fleet": "CRJ200",
      "origin": "DAY",
      "destination": "CRW",
      "legs": 2
    },
    {
      "fleet": "CRJ200",
      "origin": "DAY",
      "destination": "ERI",
      "legs": 2
    },
    {
      "fleet": "CRJ200",
      "origin": "DAY",
      "destination": "FWA",
      "legs": 4
    },
    {
      "fleet": "CRJ200",
      "origin": "DAY",
      "destination": "GRR",
      "legs": 4
    },
    {
      "fleet": "CRJ200",
      "origin": "DAY",
      "destination": "HOU",
      "legs": 4
    },
    {
      "fleet": "CRJ200",
      "origin": "DAY",
      "destination": "HSV",
      "legs": 1
    },
    {
      "fleet": "CRJ200",
      "origin": "DAY",
      "destination": "IND",
      "legs": 2
    },
    {
      "fleet": "CRJ200",
      "origin": "DAY",
      "destination": "LEX",
      "legs": 1
    },
    {
      "fleet": "CRJ200",
      "origin": "DAY",
      "destination": "MCI",
      "legs": 2
    },
    {
      "fleet": "CRJ200",
      "origin": "DAY",
      "destination": "MKE",
      "legs": 1
    },
    {
      "fleet": "CRJ200",
      "origin": "DAY",
      "destination": "MSN",
      "legs": 3
    },
    {
      "fleet": "CRJ200",
      "origin": "DAY",
      "destination": "PHF",
      "legs": 3
    },
    {
      "fleet": "CRJ200",
      "origin": "DAY",
      "destination": "PIT",
      "legs": 1
    },
    {
      "fleet": "CRJ200",